{
  "api_version": "1",
  "operation": "ukma.code.query_callers.v1",
  "context": {
    "request_id": "x",
    "trace_id": "x",
    "scope": {
      "tenant_id": "x",
      "project_id": "x"
    },
    "principal_id": "x",
    "scopes": [],
    "consistency": "eventual"
  },
  "input": {
    "direction": "in",
    "edge_kinds": [],
    "max_depth": 0,
    "max_nodes": 0,
    "page": {
      "limit": 0
    },
    "symbol_id": "x"
  }
}
